r6k/pp2r2p/4Rp1Q/3p4/8/1N1P2R1/PqP2bPP/7K b - - 0 24,f2g3 e6e7 b2b1 b3c1 b1c1 h6c1,0
5rk1/1p3ppp/pq3b2/8/8/1P1Q1N2/P4PPP/3R2K1 w - - 2 27,d3d6 f8d8 d6d8 f6d8,0
r2qr1k1/b1p2ppp/pp4n1/P1P1p3/4P1n1/B2P2Pb/3NBP1P/RN1QR1K1 b - - 1 16,b6c5 e2g4 h3g4 d1g4,0
8/8/4k1p1/2KpP2p/5PP1/8/8/8 w - - 0 53,g4h5 g6h5 f4f5 e6e5 f5f6 e5f6,0
4r3/1k6/pp3r2/1b2P2p/3R1p2/P1R2P2/1P4PP/6K1 w - - 0 35,e5f6 e8e1 g1f2 e1f1,0
r4rk1/pp3ppp/2n1b3/q1pp2B1/8/P1Q2NP1/1PP1PP1P/2KR3R w - - 0 15,g5e7 a5c3 b2c3 c6e7,0
r1bqk2r/pp1nbNp1/2p1p2p/8/2BP4/1PN3P1/P3QP1P/3R1RK1 b kq - 0 19,e8f7 e2e6 f7f8 e6f7,0
5r1k/5rp1/p7/1b2B2p/1P1P1Pq1/2R1Q3/P3p1P1/2R3K1 w - - 0 41,e3g3 f7f4 e5f4 f8f4,0
3R4/8/K7/pB2b3/1p6/1P2k3/3p4/8 w - - 4 58,a6a5 e5c7 a5b4 c7d8,0
4r3/5pk1/1p3np1/3p3p/2qQ4/P4N1P/1P3RP1/7K w - - 6 34,d4b6 f6e4 h1g1 e4f2,0
r2q1rk1/5ppp/1np5/p1b5/2p1B3/P7/1P3PPP/R1BQ1RK1 b - - 1 17,d8f6 d1h5 h7h6 h5c5,0
2kr3r/pp3p2/4p2p/1N1p2p1/3Q4/1P1P4/2q2PPP/5RK1 b - - 1 20,b7b6 d4a1 a7a5 f1c1,0
4r1k1/5ppp/r1p5/p1n1RP2/8/2P2N1P/2P3P1/3R2K1 b - - 0 21,e8e5 d1d8 e5e8 d8e8,0
1qr2rk1/pb2bppp/8/8/2p1N3/P1Bn2P1/2Q2PBP/1R3RK1 b - - 3 23,b8c7 b1b7 c7b7 e4f6 e7f6 g2b7,0
r6r/1pNk1ppp/2np4/b3p3/4P1b1/N1Q5/P4PPP/R3KB1R w KQ - 3 18,c7a8 a5c3,0
2r3k1/2r4p/4p1p1/1p1q1pP1/p1bP1P1Q/P6R/5B2/2R3K1 b - - 5 34,c4e2 h4h7 c7h7 c1c8 g8g7 c8c7,0
5r1k/pp4pp/5p2/1BbQp1r1/6K1/7P/1PP3P1/3R3R w - - 2 26,g4h4 c5f2 g2g3 f2g3,0
2r3k1/p1q2pp1/Q3p2p/b1Np4/2nP1P2/4P1P1/5K1P/2B1N3 b - - 3 33,c7b6 a6c8 g8h7 c8b7,0
1rb2rk1/q5P1/4p2p/3p3p/3P1P2/2P5/2QK3P/3R2R1 b - - 0 29,f8f7 c2h7 g8h7 g7g8q,0
r3k2r/pb1p1ppp/1b4q1/1Q2P3/8/2NP1Pn1/PP4PP/R1B2R1K w kq - 1 17,h2g3 g6h5,0
r4rk1/p3ppbp/Pp1q1np1/3PpbB1/2B5/2N5/1PPQ1PPP/3RR1K1 w - - 4 18,f2f3 d6c5 g1h1 c5c4,0
k1r1b3/p1r1nppp/1p1qpn2/2Np4/1P1P4/PQRBPN2/5PPP/2R3K1 w - - 0 19,d3a6 b6c5 a6c8 c5c4,0
8/4R1k1/p5pp/3B4/5q2/8/5P1P/6K1 b - - 5 40,g7f6 e7f7 f6e5 f7f4,0
r3kb1r/pppqpn1p/5p2/3p1bpQ/2PP4/4P1B1/PP3PPP/RN2KB1R w KQkq - 1 11,b1c3 f5g4 h5g4 d7g4,0
r7/2p2r1k/p2p1q1p/Pp1P4/1P2P3/2PQ4/6R1/R5K1 b - - 2 28,f7g7 e4e5 f6g6 g2g6,0
8/8/kpq5/p4pQp/P7/7P/3r2P1/4R2K b - - 10 48,c6a4 g5d2,0
r3brk1/5pp1/p1nqpn1p/P2pN3/2pP4/2P1PN2/5PPP/RB1QK2R b KQ - 4 16,c6e5 d4e5 d6e7 e5f6,0
r3kb1r/ppq2ppp/4pn2/2Ppn3/1P4bP/2P2N2/P3BPP1/RNBQ1RK1 b kq - 2 10,f8e7 f3e5 c7e5 e2g4,0
3r1rk1/1b1n1pp1/3p4/p4PPQ/4P3/3q1BN1/8/2R2RK1 b - - 1 28,d7e5 f5f6 e5f3 f1f3,0
r3qrk1/2p2pp1/p2bpn1p/2ppNb2/3P1P2/1PP1P1B1/P2N2PP/R2Q1RK1 b - - 0 14,f5g4 e5g4 f6g4 d1g4,0
r3kbnr/ppp1qppp/2n5/3pP3/5B2/4PQ2/PPP2PPP/RN2KB1R w KQkq - 1 7,f1b5 e7b4 b1c3 b4b2,0
r4rk1/pp3ppp/3p1q2/P1P1p3/2B5/2B2n2/2P2P1P/R2Q1RK1 w - - 0 16,g1h1 f6f4 d1f3 f4f3,0
8/6p1/2B1bn2/6k1/3B4/6K1/4P3/8 b - - 4 44,e6d5 d4f6 g5f5 c6d5,0
r6k/q1pb1p1p/1b3Pr1/p1ppP2Q/3P2p1/4B3/PP2NRPP/3R2K1 b - - 1 25,d7e6 e2f4 c5d4 f4g6 f7g6 h5h6,0
r2r2k1/1p2qppp/2n1p3/5n2/p2P4/P2Q1N2/BP3PPP/2R1R1K1 w - - 4 20,d3f5 e6f5 e1e7 c6e7,0
2nk4/8/2PBp1n1/1pK1P1p1/1P4P1/8/8/8 b - - 2 42,g6h4 c5b5 h4g2 b5a6 g2e3 a6b7,0
1r5r/p3kp2/4p2p/4P3/3R1Pp1/6P1/P1P4P/4K2R w K - 1 25,d4a4 b8b1 e1f2 b1h1 a4a7 e7f8,0
8/3pk3/R7/1R2Pp1p/2PPnKr1/8/8/8 w - - 4 43,f4f5 e4g3,0
6k1/3bqr1p/2rpp1pR/p7/Pp1QP3/1B3P2/1PP3P1/2KR4 w - - 6 22,d4a7 e7g5 c1b1 g5h6,0
2r5/pR5p/5p1k/4p3/4r3/B4nPP/PP3P2/1K2R3 w - - 0 27,e1e4 f3d2 b1a1 c8c1,0
r1bqk1nr/1pp2ppp/p1pb4/4p3/3PP3/5N2/PPP2PPP/RNBQ1RK1 b kq - 0 6,d8f6 d4e5 d6e5 c1g5 f6d6 f3e5 d6d1 f1d1,0
8/r1b1q2k/2p3p1/2Pp4/1P2p1n1/2B1P3/NQ6/2K4R b - - 1 36,h7g8 h1h8 g8f7 h8h7 f7e8 h7e7,0
rn3rk1/p5pp/3N4/4np1q/5Q2/1P3K2/PB1P2P1/2R4R w - - 0 25,f3f2 e5d3 f2e3 d3f4 h1h5 f4h5,0
r3kb1r/p4ppp/b1p1p3/3q4/3Q4/4BN2/PPP2PPP/R3K2R b KQkq - 0 11,c6c5 d4a4 a6b5 a4b5,0
1R6/1p2k2p/p2n2p1/4K3/8/6P1/P6P/8 w - - 10 37,b8h8 d6f7 e5e4 f7h8,0
r1b1k2N/ppp3pp/2n5/2bp4/7q/1B4n1/PPPP1P1P/RNBQ1RK1 w q - 0 10,f1e1 g3e4 e1e4 d5e4 d1h5 h4h5 b3f7 h5f7,0
6rk/pp6/2n5/3ppn1p/3p4/2P2P1q/PP3QNB/R4R1K w - - 2 29,f1g1 f5g3 f2g3 g8g3,0
r1bqk2r/pp1nbppp/3p4/1B1p4/3P1B2/8/PPP2PPP/R2QK1NR w KQkq - 2 9,g1f3 d8a5 d1d2 a5b5,0
r2qr1k1/ppp2ppp/4b3/3P4/1nP2Q2/2N2N1P/PP3KP1/R4R2 w - - 1 15,d5e6 b4d3 f2g1 d3f4,0
2r2rk1/6pp/3Q1q2/8/3N1B2/6P1/PP1K3P/R4b2 w - - 0 24,a1f1 f6d6 f4d6 f8f1,0
3r2k1/4nppp/pq1p1b2/1p2P3/2r2P2/2P1NR2/PP1Q2BP/3R2K1 b - - 0 24,d6e5 d2d8 b6d8 d1d8,0
rnbqkb1r/pppp2pp/8/4P3/2B5/4p3/PPPP2PP/R1BQK1NR w KQkq - 0 7,d1f3 d8h4 e1d1 h4c4,0
4r3/p5k1/2p2R1p/2Pp4/1P1pr1P1/P6P/8/3R3K w - - 1 35,f6c6 e4e1 d1e1 e8e1 h1g2 d4d3,0
4qk2/1b3rR1/p7/1p2Q3/4P2P/P2P3K/2r5/3R4 w - - 5 41,g7f7 e8f7 e5h8 f8e7,0
r1bk2r1/ppq2pQp/3bpn2/1BpnN3/5P2/1P6/PBPP2PP/RN2K2R w KQ - 3 13,e5f7 d8e7 g7g8 f6g8,0
8/7R/5p2/p7/7P/2p5/3k2r1/1K2N3 w - - 3 48,e1g2 c3c2 b1a2 c2c1q h7d7 d2e2,0
2kr2r1/1bp4n/1pq1p2p/p1P5/1P3B2/P6P/5RP1/RB2Q1K1 w - - 3 26,e1f1 d8d1 f1d1 g8g2 g1f1 g2g1 f1e2 g1d1,0
5rk1/5ppp/1p6/1qp2P1Q/3p3P/6R1/6PK/8 b - - 0 30,c5c4 g3g7 g8g7 f5f6 g7f6 h5b5,0
1r4k1/p4ppp/2Q5/3pq3/8/P6P/2PR1PP1/Rr4K1 w - - 1 26,a1b1 b8b1 d2d1 b1d1,0
r4rk1/3q1pbp/p1n1p1p1/2p3NP/1p3B2/3P3Q/PPP3P1/R3R1K1 b - - 2 19,d7d4 f4e3 d4f6 e1f1 f6e5 h5g6 e5e3 h3e3,0
8/4kr2/R2p4/1p1Pp1p1/5p2/3K1P2/PPP5/8 b - - 0 39,g5g4 a6a7 e7f6 a7f7 f6f7 f3g4,0
r2r2k1/2q1bpp1/3p1n1p/1ppN4/1P1BP3/P5Q1/4RPPP/R5K1 b - - 1 20,f6d5 g3g7,0
4rr1k/pQpn2pp/3p1q2/8/8/2P5/PP3PPP/RN3RK1 w - - 1 16,b7c7 f6f2 f1f2 e8e1 f2f1 e1f1,0
3q2k1/2r5/pp3p1Q/2b1n3/P3N3/2P5/1P4PP/R6K b - - 0 24,c7d7 e4f6 d8f6 h6f6,0
8/2k3n1/3p2p1/1KpP2Pp/2P4P/7B/8/8 w - - 0 57,b5a6 c7d8 a6b5 g7f5,0
6k1/p3b2p/1p1pP3/2p3P1/1Pnp3B/P6P/3Q3K/8 w - - 0 38,b4c5 c4d2 c5c6 d6d5 g5g6 e7d6,0
2q3k1/4br1p/6RQ/1p1n2p1/7P/1P4P1/1B2PP2/6K1 b - - 0 27,h7g6 h6h8,0
5rk1/1p2p1rp/p2p4/2pPb2R/2P1P3/1P1BKP1R/8/8 b - - 4 30,g7g3 h3g3 e5g3 h5g5 g8f7 g5g3,0
r1b2rk1/p3pp2/2B4b/2Qpq3/3N2pp/4P3/2P2PPP/1R2K2R b K - 1 23,h6e3 f2e3 e5e3 e1d1,0
3r1rk1/1pR3pp/p2bp3/1q2Np2/3P4/1P5Q/5PPP/4R1K1 w - - 2 27,c7g7 g8g7 h3g3 g7h8,0
r6k/2q3pp/8/2p1n3/R1Qp4/7P/2PB1PP1/6K1 b - - 0 32,e5c4 a4a8 c7b8 a8b8,0
2rr4/2N2pk1/p1Q1b1pp/1p4q1/3pP3/1B1P4/PPP3PP/6RK w - - 7 25,c7e6 f7e6 c6b7 g7h8,0
r5k1/2p1pp2/pp4p1/1q1r4/5P2/2QP2R1/PP6/1K4R1 b - - 0 32,d5h5 g3g6 f7g6 g1g6 g8f7 c3g7 f7e8 g7g8 e8d7 g8e6 d7d8 g6g8,0
r1b1qrk1/pp1n1pbp/2pp1np1/4p3/2PP1B2/2NBPN1P/PP3PP1/R2Q1RK1 w - - 0 10,d4e5 d6e5 f4h2 e5e4,0
8/8/1p1k1p1p/3npp2/2B5/PP1K1PP1/7P/8 b - - 0 36,f5f4 c4d5 f4g3 h2g3 d6d5 g3g4,0
8/8/5pp1/3K3p/3N2kP/8/8/8 w - - 2 62,d5e6 g6g5 h4g5 f6g5 e6d5 h5h4 d5e4 h4h3 d4f3 g4g3,0
1r6/pp2kpp1/2n1p1n1/3p2PQ/5P2/2PqP3/PP1N4/2KR3R w - - 3 27,h5h7 c6b4 c3b4 b8c8 d2c4 c8c4,0
8/3k4/1K1P4/2P3r1/R7/5b2/8/8 b - - 0 68,g5g8 a4a7 d7e6 a7e7 e6d5 d6d7,0
r1r3k1/ppq3bQ/4p2p/4n3/3p4/2P5/PBB2PPP/4R1K1 b - - 2 24,g8f8 b2a3 f8f7 c2d1 c8h8 d1h5 f7f6 h7e4,0
6k1/pp3pp1/2p1q1Pp/3b4/8/6Q1/PB3Pp1/3RrNK1 b - - 2 27,e1d1 g3b8 e6e8 b8e8,0
r2q1r1k/2p3p1/pb2Q2p/1p1p1n2/8/1BP5/PP1B1PPP/3RR1K1 w - - 3 20,b3d5 b6f2 g1f2 f5d4 f2g1 d4e6,0
r1q3k1/4bppp/pp2pn2/4B3/8/2N2Q2/PPPR1PPP/6K1 b - - 0 18,f6d7 d2d7 c8d7 f3a8,0
7r/pppk4/2pb1r2/8/2NP2p1/2P5/PP2RPP1/4R1K1 w - - 2 26,c4d6 f6h6 f2f4 g4g3 e2e7 d7d6 g1f1 h6h1,0
5rk1/R4pp1/1p5p/3Q4/1PPp2q1/3P2P1/5P2/4nK2 w - - 0 34,f1e1 f8e8 e1f1 g4h3 d5g2 e8e1 f1e1 h3g2,0
1r6/5k2/2p1pNp1/p5Pp/1pQ1P2P/2P4R/KP3P2/3q4 w - - 4 31,c4c6 b4b3 a2a3 d1a1,0
1r6/k2qn1b1/p1b1p1p1/2PpPpN1/2nN1P1P/p4B2/1PP2Q2/1K1R3R w - - 0 32,d4c6 e7c6 b2b3 a3a2 b1a1 c4e5 f4e5 g7e5 a1a2 b8b5,0
1k1r3r/2q5/pp1n2p1/8/1Q6/3R2P1/PPP2P1P/3R2K1 b - - 4 29,c7c5 b4c5 b6c5 d3d6 d8d6 d1d6,0
r5kr/pp1qb1p1/2p4p/3pPb1Q/3P4/2P1B3/PP4PP/R4RK1 b - - 1 17,f5e4 h5f7 g8h7 f1f6 e7f6 f7d7,0
8/8/2p2k2/1p1p4/3P4/1PP1pK2/8/8 b - - 3 64,f6f5 b3b4,0
1r4k1/4bpp1/1rp2n1p/3p4/3P4/2N1B1P1/Pq2QPKP/2R1R3 w - - 3 24,e3h6 b2e2 e1e2 e7a3 h6e3 a3c1,0
r2qr2k/1pp2pp1/1b4np/pP2P3/P4n2/BQN2N1P/5PP1/R3R1K1 w - - 3 20,b3f7 d8d3 c3e2 f4e2 e1e2 d3e2,0
1r3k2/5p1p/2p1pp2/P2n4/2r1N3/P4PK1/2R2P1P/2R5 b - - 9 29,c4a4 e4c5 a4a5 c5d7 f8g7 d7b8,0
2r5/4ppkp/5bp1/1p6/1P6/P3B3/2r2PPP/1R1R2K1 b - - 2 22,f6b2 b1b2 c2b2 e3d4 f7f6 d4b2,0
3Q4/5kr1/8/1P2pB2/2Pp1n2/q2P3P/7K/5R2 w - - 7 49,d8d7 f7f6 d7d8 f6f5,0
6R1/8/Kpk1p3/1p1pP3/6P1/PPP1r3/8/8 b - - 3 40,e3c3 g8c8 c6d7 c8c3,0
r4rk1/ppq2ppp/2nbp1b1/3p4/3Pn3/2PB1N1P/PP3PP1/R1BQRNK1 b - - 4 14,e4f2 g1f2 g6d3 d1d3,0
3q1nk1/1bN2rpp/pp1P4/1N6/4n2b/8/PPP2PPP/R1BQ1RK1 w - - 1 16,b5d4 h4f2 f1f2 e4f2,0
3r2k1/1b3pbR/p2P2P1/3p2N1/2p5/2P2N2/PP6/2K5 b - - 0 28,f7g6 h7g7 g8g7 g5e6 g7g8 e6d8,0
rk5r/1b3R2/pp2p2q/4P2p/B2p3B/4R2P/PP4P1/5Q1K b - - 0 27,d4e3 f7b7 b8b7 f1f7 b7b8 h4e7,0
r3kb1r/3nnpp1/4p1bp/1NppP3/3P4/6N1/P2BBPPP/R3K2R b KQkq - 0 17,a8b8 b5d6 e8d8 d2a5,0
